{
  "apex_revision": "0fa8ffc92d09d13821b4ae0d041ecebf7c94236d",
  "provider": "gemini",
  "model": "gemini-3.8-flash",
  "endpoint_ref": "Google Gemini API",
  "account_ref": "private configured Gemini account; identifier withheld from public repository",
  "host_harness": "direct APEX CLI",
  "config_digest": "sha256:3ea6418bda19d57d530c5512f7ef48ddd784b0e2900e498cbee55259e9960498",
  "workload_ref": "direct_gemini_integration_gate_v1",
  "command": "~/downloads/apex-gemini-validate.sh",
  "pass_rate": {
    "rate": 1.0,
    "gates_passed": 5,
    "gates_total": 5,
    "gates": [
      "GeminiProvider smoke",
      "pytest TestIntegration dry-run plan",
      "pytest TestIntegration write/read execution",
      "direct APEX dry-run",
      "direct APEX write/read execution"
    ]
  },
  "wall_time": {
    "integration_tests_seconds": 22.35,
    "full_gate_seconds": "not captured"
  },
  "token_metrics": {
    "provider_smoke": 131,
    "direct_dry_run": 1457,
    "direct_execution": 961,
    "known_total": 2549,
    "integration_test_tokens": "not surfaced"
  },
  "throughput_metrics": {
    "full_workload_benchmark": "not run"
  },
  "resource_observations": {
    "python": "3.12.9",
    "google_genai": "1.66.0",
    "execution": "remote Gemini inference with local APEX tool execution",
    "result_dir": "/home/u/apex-gemini-validation/20260914T210930Z"
  },
  "cash_cost": "unverified; account-specific quota, usage, billing tier, and spend remain unaudited",
  "failures": [],
  "limitations": [
    "The 12-task APEX workload benchmark has not yet been executed with this Gemini profile.",
    "The configuration digest covers the captured nonsecret validation profile only; unobserved environment variables are not included.",
    "Account identifier and API credential are intentionally excluded from the public artifact.",
    "Successful integration does not establish production workload acceptance."
  ],
  "result": "EXPERIMENTAL",
  "verified_at": "2026-09-14T17:09:30-04:00"
}
